01:27:02 | ======================================================================
01:27:02 | AUDIT-01: WIDEN CLAMP [0.5, 2.0] -> [0.1, 5.0]
01:27:02 | ======================================================================
01:27:02 | 
01:27:02 | HYPOTHESIS: SFI +0.48 is the clamp floor, not physics.
01:27:02 | EXPECTED: SFI drops below +0.48 when floor is removed.
01:27:02 | 
01:27:02 | ======================================================================
01:27:02 | IONIS audit-01 | AUDIT
01:27:02 | ======================================================================
01:27:02 | Config: /Users/gbeam/workspace/ionis-ai/ionis-training/versions/audit-01/config_audit01.json
01:27:02 | 
01:27:02 | === TRAINING ===
01:27:02 |   Device: mps
01:27:02 |   Epochs: 30
01:27:02 |   Batch size: 65,536
01:27:02 |   Validation split: 20%
01:27:02 | 
01:27:02 | === DATA ===
01:27:02 |   WSPR sample: 20,000,000
01:27:02 |   RBN Full sample: 0
01:27:02 |   RBN DX upsample: 50x
01:27:02 |   Contest upsample: 1x
01:27:02 |   Storm upsample: 0x (Kp >= 5)
01:27:02 | 
01:27:02 | === LEARNING RATES ===
01:27:02 |   Trunk + Gates: 1e-05
01:27:02 |   Sidecars: 0.001 (100x boost)
01:27:02 |   Weight decay: 1e-05
01:27:02 | 
01:27:02 | === MODEL ===
01:27:02 |   Architecture: IonisGate
01:27:02 |   DNN dim: 15
01:27:02 |   Hidden: 256 (trunk: 512→256→128→1)
01:27:02 |   Sidecar hidden: 8
01:27:02 | 
01:27:02 | wspr.signatures_v2_terrestrial: 93,596,266 rows available
01:27:10 | wspr.signatures_v2_terrestrial: loaded 20,000,000 rows in 7.7s
01:27:10 | rbn.dxpedition_signatures: 260,469 rows available
01:27:10 | rbn.dxpedition_signatures: loaded 260,459 rows in 0.1s
01:27:10 | contest.signatures: 5,737,139 rows available
01:27:12 | contest.signatures: loaded 5,737,139 rows in 1.9s
01:27:12 | 
01:27:12 | === PER-SOURCE PER-BAND NORMALIZATION ===
01:27:13 |   WSPR:    mean=-0.000, std=0.948
01:27:13 |   RBN DX:  mean=-0.036, std=1.054
01:27:13 |   Contest: mean=3.537, std=0.764
01:27:13 | 
01:27:13 | Engineering features...
01:27:13 |   dnn_dim=15 (V22-gamma recipe)
01:27:46 | Upsampling RBN DXpedition 50x...
01:27:46 | 
01:27:46 | Combined dataset: 38,760,089 rows
01:27:46 |   WSPR:     20,000,000 (51.6%)
01:27:46 |   RBN DX:   13,022,950 (33.6%)
01:27:46 |   Contest:  5,737,139 (14.8%)
01:27:46 | Normalized SNR: mean=0.511, std=1.586
01:27:46 | Source data range: 2008-03-11 to 2026-02-22
01:27:47 | Split: 31,008,072 train / 7,752,017 val
01:27:47 | Model: IonisGate (205,621 params)
01:27:47 | Defibrillator applied: sidecar weights uniform(0.8-1.2), fc2.bias=-10.0, fc1.bias frozen
01:27:47 | Trainable: 205,605 / 205,621
01:27:47 | 
01:27:47 | === INITIAL WEIGHTS (POST-DEFIBRILLATOR) ===
01:27:47 |   SUN SIDECAR WEIGHTS (epoch 0):
01:27:47 |     fc1: min=0.8217, max=1.1324, mean=1.0100
01:27:47 |     fc2: min=0.8079, max=1.1943, mean=1.0323
01:27:47 |   STORM SIDECAR WEIGHTS (epoch 0):
01:27:47 |     fc1: min=0.8390, max=1.1519
01:27:47 |     fc2: min=0.8367, max=1.1859
01:27:48 | 
01:27:48 | Training started (30 epochs)
01:27:48 | *** USING WIDENED CLAMP [0.1, 5.0] ***
01:27:48 | 
01:27:48 |  Ep     Train       Val     RMSE   Pearson    SFI+   Kp9-    Time
01:27:48 | -----------------------------------------------------------------
01:30:55 |   1    1.0329    0.9399   0.969σ  +0.0048  +2.515  +6.30  187.6s *
01:30:55 |   SUN SIDECAR WEIGHTS (epoch 1):
01:30:55 |     fc1: min=0.8542, max=1.1629, mean=1.0412
01:30:55 |     fc2: min=0.8985, max=1.2849, mean=1.1248
01:30:55 |   STORM SIDECAR WEIGHTS (epoch 1):
01:30:55 |     fc1: min=0.9435, max=1.2556
01:30:55 |     fc2: min=0.9464, max=1.2946
01:34:02 |   2    0.7539    0.8425   0.918σ  +0.0524  +2.277  +6.21  186.4s *
01:37:07 |   3    0.7236    0.8227   0.907σ  +0.1027  +2.042  +6.09  184.7s *
01:40:13 |   4    0.7102    0.8098   0.900σ  +0.1435  +1.804  +5.94  186.7s *
01:43:25 |   5    0.6999    0.7997   0.894σ  +0.1827  +1.574  +5.77  192.1s *
01:43:25 |   SUN SIDECAR WEIGHTS (epoch 5):
01:43:25 |     fc1: min=0.5480, max=0.8504, mean=0.7309
01:43:25 |     fc2: min=0.8234, max=1.2094, mean=1.0573
01:43:25 |   STORM SIDECAR WEIGHTS (epoch 5):
01:43:25 |     fc1: min=0.8834, max=1.1951
01:43:25 |     fc2: min=0.9250, max=1.2684
01:46:38 |   6    0.6886    0.7886   0.888σ  +0.2304  +1.348  +5.55  192.5s *
01:49:49 |   7    0.6765    0.7777   0.882σ  +0.2773  +1.133  +5.29  191.2s *
01:52:57 |   8    0.6671    0.7718   0.879σ  +0.3070  +0.942  +5.02  187.5s *
01:56:05 |   9    0.6611    0.7670   0.876σ  +0.3243  +0.775  +4.75  188.1s *
01:59:13 |  10    0.6570    0.7656   0.875σ  +0.3352  +0.629  +4.47  188.5s *
01:59:13 |   SUN SIDECAR WEIGHTS (epoch 10):
01:59:13 |     fc1: min=0.1557, max=0.4511, mean=0.3327
01:59:13 |     fc2: min=0.7507, max=1.1444, mean=0.9964
01:59:13 |   STORM SIDECAR WEIGHTS (epoch 10):
01:59:13 |     fc1: min=0.7233, max=1.0328
01:59:13 |     fc2: min=0.8704, max=1.1999
02:02:23 |  11    0.6537    0.7634   0.874σ  +0.3433  +0.502  +4.20  190.0s *
02:05:35 |  12    0.6511    0.7606   0.872σ  +0.3499  +0.405  +3.91  191.7s *
02:08:42 |  13    0.6489    0.7589   0.871σ  +0.3557  +0.319  +3.64  187.3s *
02:11:50 |  14    0.6470    0.7559   0.869σ  +0.3606  +0.251  +3.38  187.9s *
02:14:58 |  15    0.6453    0.7557   0.869σ  +0.3643  +0.199  +3.14  187.6s *
02:14:58 |   SUN SIDECAR WEIGHTS (epoch 15):
02:14:58 |     fc1: min=0.1000, max=0.1593, mean=0.1135
02:14:58 |     fc2: min=0.7415, max=1.1493, mean=0.9965
02:14:58 |   STORM SIDECAR WEIGHTS (epoch 15):
02:14:58 |     fc1: min=0.5220, max=0.8266
02:14:58 |     fc2: min=0.8321, max=1.1383
02:18:08 |  16    0.6439    0.7560   0.870σ  +0.3671  +0.177  +2.93  190.3s
02:21:17 |  17    0.6428    0.7533   0.868σ  +0.3695  +0.178  +2.74  189.2s *
02:24:25 |  18    0.6419    0.7524   0.867σ  +0.3706  +0.178  +2.59  188.1s *
02:27:32 |  19    0.6411    0.7511   0.867σ  +0.3723  +0.178  +2.46  187.0s *
02:30:41 |  20    0.6403    0.7528   0.868σ  +0.3735  +0.179  +2.37  188.1s
02:30:41 |   SUN SIDECAR WEIGHTS (epoch 20):
02:30:41 |     fc1: min=0.1000, max=0.1000, mean=0.1000
02:30:41 |     fc2: min=0.7521, max=1.1609, mean=1.0079
02:30:41 |   STORM SIDECAR WEIGHTS (epoch 20):
02:30:41 |     fc1: min=0.3835, max=0.6850
02:30:41 |     fc2: min=0.8228, max=1.1102
02:33:49 |  21    0.6398    0.7509   0.867σ  +0.3743  +0.179  +2.29  188.6s *
02:36:58 |  22    0.6393    0.7509   0.867σ  +0.3753  +0.179  +2.24  189.2s *
02:40:07 |  23    0.6388    0.7489   0.865σ  +0.3758  +0.179  +2.19  188.3s *
02:43:18 |  24    0.6384    0.7501   0.866σ  +0.3764  +0.179  +2.16  191.0s
02:46:27 |  25    0.6382    0.7502   0.866σ  +0.3771  +0.179  +2.14  189.3s
02:46:27 |   SUN SIDECAR WEIGHTS (epoch 25):
02:46:27 |     fc1: min=0.1000, max=0.1000, mean=0.1000
02:46:27 |     fc2: min=0.7535, max=1.1623, mean=1.0093
02:46:27 |   STORM SIDECAR WEIGHTS (epoch 25):
02:46:27 |     fc1: min=0.3371, max=0.6380
02:46:27 |     fc2: min=0.8255, max=1.1057
02:49:37 |  26    0.6379    0.7495   0.866σ  +0.3775  +0.179  +2.13  190.1s
02:52:47 |  27    0.6377    0.7495   0.866σ  +0.3777  +0.179  +2.12  190.1s
02:55:59 |  28    0.6375    0.7496   0.866σ  +0.3783  +0.179  +2.11  191.3s
02:59:11 |  29    0.6372    0.7487   0.865σ  +0.3785  +0.179  +2.11  192.8s *
03:02:23 |  30    0.6370    0.7489   0.865σ  +0.3787  +0.179  +2.11  192.0s
03:02:23 |   SUN SIDECAR WEIGHTS (epoch 30):
03:02:23 |     fc1: min=0.1000, max=0.1000, mean=0.1000
03:02:23 |     fc2: min=0.7532, max=1.1620, mean=1.0090
03:02:23 |   STORM SIDECAR WEIGHTS (epoch 30):
03:02:23 |     fc1: min=0.3299, max=0.6307
03:02:23 |     fc2: min=0.8263, max=1.1054
03:02:23 | -----------------------------------------------------------------
03:02:23 | 
03:02:23 | ======================================================================
03:02:23 | AUDIT-01 RESULTS
03:02:23 | ======================================================================
03:02:23 | 
03:02:23 | === FINAL WEIGHTS ===
03:02:23 |   SUN SIDECAR WEIGHTS (epoch 30):
03:02:23 |     fc1: min=0.1000, max=0.1000, mean=0.1000
03:02:23 |     fc2: min=0.7532, max=1.1620, mean=1.0090
03:02:23 |   STORM SIDECAR WEIGHTS (epoch 30):
03:02:23 |     fc1: min=0.3299, max=0.6307
03:02:23 |     fc2: min=0.8263, max=1.1054
03:02:23 | 
03:02:23 | AUDIT-01 SUMMARY:
03:02:23 |   Best RMSE: 0.8653σ
03:02:23 |   Best Pearson: +0.3785
03:02:23 |   Final SFI+: +0.1788σ
03:02:23 |   Final Kp9-: +2.1076σ
03:02:23 | 
03:02:23 | >>> HYPOTHESIS CONFIRMED <<<
03:02:23 | >>> SFI dropped to +0.1788σ (below +0.48) <<<
03:02:23 | >>> The +0.48 was the clamp floor, not physics <<<
03:02:23 | 
03:02:23 | Checkpoint: /Users/gbeam/workspace/ionis-ai/ionis-training/versions/audit-01/ionis_audit01.safetensors
03:02:23 | Wall time: 95.3 minutes
